{
  "$id": "https://example.org/hpo-translations/ontology-network/conflict_report_row.schema.json",
  "$schema": "https://json-schema.org/draft/2020-12/schema",
  "additionalProperties": false,
  "properties": {
    "agent_panel_action": {
      "type": "string"
    },
    "agent_panel_assessment_required": {
      "type": "boolean"
    },
    "conflict_id": {
      "type": "string"
    },
    "conflict_type": {
      "type": "string"
    },
    "count": {
      "type": "integer"
    },
    "evidence_ids": {
      "items": {
        "type": "string"
      },
      "type": "array"
    },
    "hpo_id": {
      "type": "string"
    },
    "language": {
      "type": "string"
    },
    "maintainer_promotion_decision_required": {
      "type": "boolean"
    },
    "provenance_id": {
      "type": "string"
    },
    "resolution_status": {
      "type": "string"
    },
    "severity": {
      "type": "string"
    },
    "source_ids": {
      "items": {
        "type": "string"
      },
      "type": "array"
    }
  },
  "required": [
    "agent_panel_action",
    "conflict_id",
    "conflict_type",
    "evidence_ids",
    "hpo_id",
    "provenance_id",
    "resolution_status",
    "severity",
    "source_ids"
  ],
  "title": "conflict_report_row",
  "type": "object",
  "x-schema-version": "2.0.0"
}
